{
  "schema_version": "1.0.0",
  "trip_id": "balkan-roadtrip-2026",
  "description": "Centralna baza koordinat. Vse druge datoteke naj se sklicujejo na te ID-je.",
  "locations": [
    {
      "id": "jajce-st-mary",
      "name": "Cerkev sv. Marije in zvonik sv. Luke",
      "lat": null,
      "lng": null,
      "status": "missing",
      "source": "to_be_verified"
    },
    {
      "id": "jajce-fortress",
      "name": "Citadela Jajce",
      "lat": null,
      "lng": null,
      "status": "missing",
      "source": "to_be_verified"
    },
    {
      "id": "jajce-catacombs",
      "name": "Katakombe",
      "lat": null,
      "lng": null,
      "status": "missing",
      "source": "to_be_verified"
    },
    {
      "id": "jajce-bear-tower",
      "name": "Medvedji stolp",
      "lat": null,
      "lng": null,
      "status": "missing",
      "source": "to_be_verified"
    },
    {
      "id": "jajce-avnoj",
      "name": "Muzej AVNOJ-a",
      "lat": null,
      "lng": null,
      "status": "missing",
      "source": "to_be_verified"
    },
    {
      "id": "jajce-waterfall",
      "name": "Plivski slap",
      "lat": null,
      "lng": null,
      "status": "missing",
      "source": "to_be_verified"
    },
    {
      "id": "jajce-old-town",
      "name": "Staro mesto Jajce",
      "lat": null,
      "lng": null,
      "status": "missing",
      "source": "to_be_verified"
    },
    {
      "id": "sarajevo-bascarsija",
      "name": "Baščaršija",
      "lat": null,
      "lng": null,
      "status": "missing",
      "source": "to_be_verified"
    },
    {
      "id": "sarajevo-emperors-mosque",
      "name": "Careva džamija",
      "lat": null,
      "lng": null,
      "status": "missing",
      "source": "to_be_verified"
    },
    {
      "id": "sarajevo-bezistan",
      "name": "Gazi Husrev-begov bezistan",
      "lat": null,
      "lng": null,
      "status": "missing",
      "source": "to_be_verified"
    },
    {
      "id": "sarajevo-ghb-library",
      "name": "Gazi Husrev-begova knjižnica",
      "lat": null,
      "lng": null,
      "status": "missing",
      "source": "to_be_verified"
    },
    {
      "id": "sarajevo-gazi-husrev-mosque",
      "name": "Gazi Husrev-begova mošeja",
      "lat": null,
      "lng": null,
      "status": "missing",
      "source": "to_be_verified"
    },
    {
      "id": "sarajevo-hotel-europe",
      "name": "Hotel Europe",
      "lat": null,
      "lng": null,
      "status": "missing",
      "source": "to_be_verified"
    },
    {
      "id": "holiday-inn",
      "name": "Hotel Holiday",
      "lat": null,
      "lng": null,
      "status": "missing",
      "source": "to_be_verified"
    },
    {
      "id": "sarajevo-inat-kuca",
      "name": "Inat kuća",
      "lat": null,
      "lng": null,
      "status": "missing",
      "source": "to_be_verified"
    },
    {
      "id": "sarajevo-jewish-museum",
      "name": "Judovski muzej Bosne in Hercegovine",
      "lat": null,
      "lng": null,
      "status": "missing",
      "source": "to_be_verified"
    },
    {
      "id": "sarajevo-sacred-heart",
      "name": "Katedrala Srca Jezusovega",
      "lat": null,
      "lng": null,
      "status": "missing",
      "source": "to_be_verified"
    },
    {
      "id": "sarajevo-kazandziluk",
      "name": "Kazandžiluk",
      "lat": null,
      "lng": null,
      "status": "missing",
      "source": "to_be_verified"
    },
    {
      "id": "sarajevo-kursumlija",
      "name": "Kuršumlija medresa",
      "lat": null,
      "lng": null,
      "status": "missing",
      "source": "to_be_verified"
    },
    {
      "id": "sarajevo-latin-bridge",
      "name": "Latinska ćuprija",
      "lat": null,
      "lng": null,
      "status": "missing",
      "source": "to_be_verified"
    },
    {
      "id": "sarajevo-morica-han",
      "name": "Morića Han",
      "lat": null,
      "lng": null,
      "status": "missing",
      "source": "to_be_verified"
    },
    {
      "id": "sarajevo-assassination-museum",
      "name": "Muzej Sarajeva 1878–1918 in kraj atentata",
      "lat": null,
      "lng": null,
      "status": "missing",
      "source": "to_be_verified"
    },
    {
      "id": "siege-front-line",
      "name": "Nekdanja frontna črta obleganja",
      "lat": null,
      "lng": null,
      "status": "missing",
      "source": "to_be_verified"
    },
    {
      "id": "nermine-come",
      "name": "Nermine, dođi",
      "lat": null,
      "lng": null,
      "status": "missing",
      "source": "to_be_verified"
    },
    {
      "id": "presidency-bih",
      "name": "Predsedstvo Bosne in Hercegovine",
      "lat": null,
      "lng": null,
      "status": "missing",
      "source": "to_be_verified"
    },
    {
      "id": "sarajevo-clock-tower",
      "name": "Sahat-kula",
      "lat": null,
      "lng": null,
      "status": "missing",
      "source": "to_be_verified"
    },
    {
      "id": "sarajevo-meeting-cultures",
      "name": "Sarajevo Meeting of Cultures",
      "lat": null,
      "lng": null,
      "status": "missing",
      "source": "to_be_verified"
    },
    {
      "id": "sarajevo-rose-war",
      "name": "Sarajevska roža",
      "lat": null,
      "lng": null,
      "status": "missing",
      "source": "to_be_verified"
    },
    {
      "id": "sarajevo-city-hall",
      "name": "Sarajevska vijećnica",
      "lat": null,
      "lng": null,
      "status": "missing",
      "source": "to_be_verified"
    },
    {
      "id": "sarajevo-sebilj",
      "name": "Sebilj",
      "lat": null,
      "lng": null,
      "status": "missing",
      "source": "to_be_verified"
    },
    {
      "id": "sniper-alley",
      "name": "Sniper Alley",
      "lat": null,
      "lng": null,
      "status": "missing",
      "source": "to_be_verified"
    },
    {
      "id": "murdered-children-memorial",
      "name": "Spomenik umorjenim otrokom obleganega Sarajeva",
      "lat": null,
      "lng": null,
      "status": "missing",
      "source": "to_be_verified"
    },
    {
      "id": "sarajevo-orthodox-cathedral",
      "name": "Stolna cerkev Rojstva Presvete Bogorodice",
      "lat": null,
      "lng": null,
      "status": "missing",
      "source": "to_be_verified"
    },
    {
      "id": "sarajevo-taslihan",
      "name": "Tašlihan",
      "lat": null,
      "lng": null,
      "status": "missing",
      "source": "to_be_verified"
    },
    {
      "id": "war-acrobats",
      "name": "War Acrobats",
      "lat": null,
      "lng": null,
      "status": "missing",
      "source": "to_be_verified"
    },
    {
      "id": "salona-amphitheatre",
      "name": "Amfiteater",
      "lat": null,
      "lng": null,
      "status": "missing",
      "source": "to_be_verified"
    },
    {
      "id": "salona-entrance",
      "name": "Arheološki park Salona",
      "lat": null,
      "lng": null,
      "status": "missing",
      "source": "to_be_verified"
    },
    {
      "id": "klis-st-vitus",
      "name": "Cerkev sv. Vida",
      "lat": null,
      "lng": null,
      "status": "missing",
      "source": "to_be_verified"
    },
    {
      "id": "salona-forum",
      "name": "Forum in mestno jedro",
      "lat": null,
      "lng": null,
      "status": "missing",
      "source": "to_be_verified"
    },
    {
      "id": "plitvice-galovacki-buk",
      "name": "Galovački buk",
      "lat": null,
      "lng": null,
      "status": "missing",
      "source": "to_be_verified"
    },
    {
      "id": "klis-main-gate",
      "name": "Glavna vrata trdnjave Klis",
      "lat": null,
      "lng": null,
      "status": "missing",
      "source": "to_be_verified"
    },
    {
      "id": "trogir-main-square",
      "name": "Glavni mestni trg",
      "lat": null,
      "lng": null,
      "status": "missing",
      "source": "to_be_verified"
    },
    {
      "id": "plitvice-supljara",
      "name": "Jama Šupljara",
      "lat": null,
      "lng": null,
      "status": "missing",
      "source": "to_be_verified"
    },
    {
      "id": "plitvice-kozjak",
      "name": "Jezero Kozjak",
      "lat": null,
      "lng": null,
      "status": "missing",
      "source": "to_be_verified"
    },
    {
      "id": "trogir-cathedral",
      "name": "Katedrala sv. Lovrenca",
      "lat": null,
      "lng": null,
      "status": "missing",
      "source": "to_be_verified"
    },
    {
      "id": "kastel-gomilica",
      "name": "Kaštel Gomilica – Kaštilac",
      "lat": null,
      "lng": null,
      "status": "missing",
      "source": "to_be_verified"
    },
    {
      "id": "krka-boardwalks",
      "name": "Lesene poti",
      "lat": null,
      "lng": null,
      "status": "missing",
      "source": "to_be_verified"
    },
    {
      "id": "plitvice-boardwalks",
      "name": "Lesene steze Zgornjih jezer",
      "lat": null,
      "lng": null,
      "status": "missing",
      "source": "to_be_verified"
    },
    {
      "id": "salona-manastirine",
      "name": "Manastirine",
      "lat": null,
      "lng": null,
      "status": "missing",
      "source": "to_be_verified"
    },
    {
      "id": "trogir-streets",
      "name": "Ozke ulice starega Trogirja",
      "lat": null,
      "lng": null,
      "status": "missing",
      "source": "to_be_verified"
    },
    {
      "id": "plitvice-train-return",
      "name": "Panoramski prevoz nazaj",
      "lat": null,
      "lng": null,
      "status": "missing",
      "source": "to_be_verified"
    },
    {
      "id": "klis-viewpoint",
      "name": "Panoramski razgled s Klisa",
      "lat": null,
      "lng": null,
      "status": "missing",
      "source": "to_be_verified"
    },
    {
      "id": "salona-porta-caesarea",
      "name": "Porta Caesarea",
      "lat": null,
      "lng": null,
      "status": "missing",
      "source": "to_be_verified"
    },
    {
      "id": "krka-skradin-return",
      "name": "Povratek v Skradin",
      "lat": null,
      "lng": null,
      "status": "missing",
      "source": "to_be_verified"